{
  "schema_version": "1.0.0",
  "artifact_type": "idea",
  "id": "IDEA-0001",
  "created_at": "2026-09-21T10:00:00Z",
  "created_by": { "type": "human", "id": "zarl3", "role": "author" },
  "title": "Аутентифицированный пользователь создаёт заявку",
  "problem": "Нет способа создать заявку через API с гарантией, что пользователь видит только свои заявки и что событие о создании надёжно доставляется вниз по потоку.",
  "actor_goal": "Аутентифицированный пользователь создаёт заявку через REST и получает её при чтении; система надёжно публикует событие RequestCreated.",
  "source": { "kind": "issue", "ref": "issue#1", "trust_tier": "untrusted" },
  "notes": "Первая golden-path feature платформы."
}
